{
  "$schema": "https://json-schema.org/draft/2020-12/schema",
  "$id": "openmathmodel.contracts.v1.paper-export",
  "title": "PaperExport",
  "description": "论文导出任务（ADR-0012 阶段 A）：客户端提交完整 .tex 源，服务端排队编译 PDF。tex 源与 PDF 都是 kind=paper 的 Artifact，PDF 的 inputs 指向 tex 源；下载沿用 /v1/artifacts/{id}/download。",
  "type": "object",
  "properties": {
    "id": { "type": "string", "pattern": "^pex_[0-9a-f]{32}$" },
    "project_id": { "type": "string", "pattern": "^proj_[0-9a-f]{32}$" },
    "run_id": {
      "oneOf": [
        { "type": "null" },
        { "type": "string", "pattern": "^run_[0-9a-f]{32}$" }
      ],
      "description": "关联的工作台运行；带 run_id 的导出完成时沿 run 事件流追加 paper.export.finished。"
    },
    "format": {
      "type": "string",
      "enum": ["pdf", "tex"],
      "description": "pdf = 排队编译；tex = 只落源产物并立即 READY。"
    },
    "status": {
      "type": "string",
      "enum": ["QUEUED", "RUNNING", "READY", "FAILED", "UNSUPPORTED"],
      "description": "UNSUPPORTED = 服务端未安装编译器，诚实降级不伪装成功。"
    },
    "artifact_id": {
      "oneOf": [
        { "type": "null" },
        { "type": "string", "pattern": "^art_[0-9a-f]{32}$" }
      ],
      "description": "交付产物：format=pdf 时为编译出的 PDF，format=tex 时为 tex 源产物。"
    },
    "source_artifact_id": {
      "oneOf": [
        { "type": "null" },
        { "type": "string", "pattern": "^art_[0-9a-f]{32}$" }
      ],
      "description": "受理时落库的 .tex 源产物；编译失败仍可下载排查。"
    },
    "detail": {
      "oneOf": [
        { "type": "null" },
        { "type": "string", "maxLength": 500 }
      ],
      "description": "FAILED 时为编译日志尾部；UNSUPPORTED 时为启用途径说明。"
    },
    "created_at": { "$ref": "#/$defs/timestamp" },
    "started_at": {
      "oneOf": [{ "type": "null" }, { "$ref": "#/$defs/timestamp" }]
    },
    "ended_at": {
      "oneOf": [{ "type": "null" }, { "$ref": "#/$defs/timestamp" }]
    }
  },
  "required": ["id", "project_id", "format", "status", "created_at"],
  "additionalProperties": false,
  "$defs": {
    "timestamp": {
      "type": "string",
      "pattern": "^\\d{4}-\\d{2}-\\d{2}T\\d{2}:\\d{2}:\\d{2}(\\.\\d{1,6})?Z$",
      "description": "UTC ISO-8601，统一以 Z 结尾。"
    }
  }
}
